{
  "source_metadata": {
    "source_file": "fixture-d-two-storey.pdf",
    "file_type": "pdf",
    "page_number": 1,
    "total_pages": 2,
    "dimensions_pixels": {
      "width": 1754,
      "height": 1240
    },
    "dpi": 150.0,
    "orientation_degrees": 0,
    "source_floor_hint": "Ground Floor & First Floor Multi-page Set",
    "preprocessing_applied": [
      "Rendered PDF page 1 at 150.0 DPI",
      "Extracted 2 floor plans"
    ]
  },
  "status": "extracted",
  "confidence_summary": {
    "overall_confidence": 0.94,
    "dimension_reliability": "high",
    "notes": "Coordinated 2-storey residential plan with vertically aligned stair core"
  },
  "walls": [
    {
      "id": "W-L1-EXT-N",
      "wall_type": "exterior",
      "start_point_pixel": [
        100,
        100
      ],
      "end_point_pixel": [
        700,
        100
      ],
      "thickness_mm": 200.0,
      "thickness_category": "explicit",
      "confidence": 0.96,
      "provenance": "source_sketch",
      "source_bbox": [
        0.15,
        0.12,
        0.17,
        0.83
      ]
    },
    {
      "id": "W-L1-EXT-S",
      "wall_type": "exterior",
      "start_point_pixel": [
        100,
        480
      ],
      "end_point_pixel": [
        700,
        480
      ],
      "thickness_mm": 200.0,
      "thickness_category": "explicit",
      "confidence": 0.96,
      "provenance": "source_sketch",
      "source_bbox": [
        0.8,
        0.12,
        0.82,
        0.83
      ]
    }
  ],
  "openings": [],
  "rooms": [
    {
      "id": "R-GF-1",
      "raw_label": "LIVING ROOM",
      "standardized_type": "LIVING",
      "floor_level": "ground",
      "approx_width_mm": 4000.0,
      "approx_depth_mm": 5000.0,
      "dimension_provenance": "explicit",
      "confidence": 0.95,
      "source_bbox": [
        0.2,
        0.15,
        0.7,
        0.45
      ]
    },
    {
      "id": "R-1F-1",
      "raw_label": "MASTER BEDROOM",
      "standardized_type": "BEDROOM",
      "floor_level": "first_floor",
      "approx_width_mm": 4000.0,
      "approx_depth_mm": 5000.0,
      "dimension_provenance": "explicit",
      "confidence": 0.95,
      "source_bbox": [
        0.2,
        0.15,
        0.7,
        0.45
      ]
    }
  ],
  "stairs": [
    {
      "id": "STAIR-CORE-01",
      "direction": "up",
      "riser_count_hint": 16,
      "width_mm_hint": 1000.0,
      "confidence": 0.96,
      "source_bbox": [
        0.2,
        0.5,
        0.4,
        0.65
      ]
    }
  ],
  "dimensions": [
    {
      "id": "DIM-W",
      "source_text": "8000 mm",
      "value_mm": 8000.0,
      "category": "explicit",
      "target_entity_type": "overall_width",
      "confidence": 0.98,
      "source_bbox": [
        0.85,
        0.4,
        0.9,
        0.6
      ]
    },
    {
      "id": "DIM-D",
      "source_text": "6000 mm",
      "value_mm": 6000.0,
      "category": "explicit",
      "target_entity_type": "overall_depth",
      "confidence": 0.98,
      "source_bbox": [
        0.4,
        0.05,
        0.6,
        0.1
      ]
    }
  ],
  "uncertainties": []
}