{
  "source_metadata": {
    "source_file": "fixture-a-clean-single-floor.png",
    "file_type": "png",
    "page_number": 1,
    "total_pages": 1,
    "dimensions_pixels": {
      "width": 1200,
      "height": 900
    },
    "dpi": 72.0,
    "orientation_degrees": 0,
    "source_floor_hint": "Ground Floor",
    "preprocessing_applied": [
      "Deterministic RGB normalization"
    ]
  },
  "status": "extracted",
  "confidence_summary": {
    "overall_confidence": 0.95,
    "dimension_reliability": "high",
    "notes": "Clean orthogonal hand sketch with complete explicit dimensioning"
  },
  "walls": [
    {
      "id": "W-EXT-NORTH",
      "wall_type": "exterior",
      "start_point_pixel": [
        200,
        200
      ],
      "end_point_pixel": [
        1000,
        200
      ],
      "thickness_mm": 200.0,
      "thickness_category": "explicit",
      "confidence": 0.98,
      "provenance": "source_sketch",
      "source_bbox": [
        0.22,
        0.16,
        0.23,
        0.84
      ]
    },
    {
      "id": "W-EXT-EAST",
      "wall_type": "exterior",
      "start_point_pixel": [
        1000,
        200
      ],
      "end_point_pixel": [
        1000,
        700
      ],
      "thickness_mm": 200.0,
      "thickness_category": "explicit",
      "confidence": 0.98,
      "provenance": "source_sketch",
      "source_bbox": [
        0.22,
        0.83,
        0.78,
        0.84
      ]
    },
    {
      "id": "W-EXT-SOUTH",
      "wall_type": "exterior",
      "start_point_pixel": [
        1000,
        700
      ],
      "end_point_pixel": [
        200,
        700
      ],
      "thickness_mm": 200.0,
      "thickness_category": "explicit",
      "confidence": 0.98,
      "provenance": "source_sketch",
      "source_bbox": [
        0.77,
        0.16,
        0.78,
        0.84
      ]
    },
    {
      "id": "W-EXT-WEST",
      "wall_type": "exterior",
      "start_point_pixel": [
        200,
        700
      ],
      "end_point_pixel": [
        200,
        200
      ],
      "thickness_mm": 200.0,
      "thickness_category": "explicit",
      "confidence": 0.98,
      "provenance": "source_sketch",
      "source_bbox": [
        0.22,
        0.16,
        0.78,
        0.17
      ]
    },
    {
      "id": "W-INTR-H",
      "wall_type": "interior",
      "start_point_pixel": [
        200,
        450
      ],
      "end_point_pixel": [
        1000,
        450
      ],
      "thickness_mm": 150.0,
      "thickness_category": "explicit",
      "confidence": 0.95,
      "provenance": "source_sketch",
      "source_bbox": [
        0.5,
        0.16,
        0.51,
        0.84
      ]
    },
    {
      "id": "W-INTR-V",
      "wall_type": "interior",
      "start_point_pixel": [
        650,
        450
      ],
      "end_point_pixel": [
        650,
        700
      ],
      "thickness_mm": 150.0,
      "thickness_category": "explicit",
      "confidence": 0.95,
      "provenance": "source_sketch",
      "source_bbox": [
        0.5,
        0.54,
        0.78,
        0.55
      ]
    }
  ],
  "openings": [
    {
      "id": "D-01",
      "type": "door",
      "swing_direction": "inward_right",
      "width_mm": 900.0,
      "width_category": "explicit",
      "host_wall_ref": "W-EXT-NORTH",
      "confidence": 0.96,
      "provenance": "source_sketch",
      "source_bbox": [
        0.21,
        0.45,
        0.24,
        0.55
      ]
    },
    {
      "id": "W-01",
      "type": "window",
      "swing_direction": null,
      "width_mm": 1200.0,
      "width_category": "explicit",
      "host_wall_ref": "W-EXT-WEST",
      "confidence": 0.94,
      "provenance": "source_sketch",
      "source_bbox": [
        0.35,
        0.15,
        0.45,
        0.18
      ]
    }
  ],
  "rooms": [
    {
      "id": "R-01",
      "raw_label": "LIVING / DINING ROOM",
      "standardized_type": "LIVING",
      "floor_level": "ground",
      "approx_width_mm": 6000.0,
      "approx_depth_mm": 2800.0,
      "dimension_provenance": "explicit",
      "confidence": 0.96,
      "source_bbox": [
        0.25,
        0.2,
        0.48,
        0.8
      ]
    },
    {
      "id": "R-02",
      "raw_label": "BEDROOM 1",
      "standardized_type": "BEDROOM",
      "floor_level": "ground",
      "approx_width_mm": 3600.0,
      "approx_depth_mm": 2200.0,
      "dimension_provenance": "explicit",
      "confidence": 0.95,
      "source_bbox": [
        0.52,
        0.2,
        0.75,
        0.52
      ]
    },
    {
      "id": "R-03",
      "raw_label": "BATHROOM",
      "standardized_type": "BATHROOM",
      "floor_level": "ground",
      "approx_width_mm": 2400.0,
      "approx_depth_mm": 2200.0,
      "dimension_provenance": "explicit",
      "confidence": 0.95,
      "source_bbox": [
        0.52,
        0.56,
        0.75,
        0.8
      ]
    }
  ],
  "dimensions": [
    {
      "id": "DIM-1",
      "source_text": "6000 mm",
      "value_mm": 6000.0,
      "category": "explicit",
      "target_entity_type": "overall_width",
      "confidence": 0.98,
      "source_bbox": [
        0.15,
        0.45,
        0.18,
        0.55
      ]
    },
    {
      "id": "DIM-2",
      "source_text": "5000 mm",
      "value_mm": 5000.0,
      "category": "explicit",
      "target_entity_type": "overall_depth",
      "confidence": 0.98,
      "source_bbox": [
        0.45,
        0.08,
        0.55,
        0.15
      ]
    },
    {
      "id": "DIM-3",
      "source_text": "3600",
      "value_mm": 3600.0,
      "category": "explicit",
      "target_entity_type": "room_width",
      "confidence": 0.95,
      "source_bbox": [
        0.78,
        0.3,
        0.82,
        0.45
      ]
    },
    {
      "id": "DIM-4",
      "source_text": "2400",
      "value_mm": 2400.0,
      "category": "explicit",
      "target_entity_type": "room_width",
      "confidence": 0.95,
      "source_bbox": [
        0.78,
        0.65,
        0.82,
        0.75
      ]
    }
  ],
  "uncertainties": []
}